{
  "$schema": "../../../../schemas/campaign.schema.json",
  "id": "campaign_vampire",
  "raceId": "vampire",
  "title": "Blood Dynasty",
  "subtitle": "Shadows of the Eternal Night",
  "description": "Rule from the shadows as the ancient vampire houses vie for supremacy. Navigate centuries of intrigue, cultivate your bloodline's power, and either unite the clans under your banner or watch them destroy each other in endless warfare.",
  "shortDescription": "Unite the vampire clans and establish eternal dominion from the shadows.",

  "story": {
    "synopsis": "The vampire progenitor has been destroyed, and without his unifying will, the great houses descend into civil war. As heir to House Corvinus, you must either unite the clans or emerge as the sole survivor of the Long Night.",
    "prologue": "For millennia, the First Vampire ruled all kindred from the shadows, his will absolute. But someone has committed the unthinkable - the progenitor is dead, his essence scattered to the winds. Now the great houses turn upon each other, each seeking to claim his throne. The Long Night has begun, and only the strongest bloodline will see its end.",
    "epilogue": "The blood wars are over. House Corvinus stands supreme, its enemies destroyed or subjugated. But ruling the kindred proves more challenging than conquering them. As the new Blood King, you must forge order from chaos - and protect your kind from the mortal hunters who grow ever bolder.",
    "keyCharacters": ["lord_corvinus", "countess_bathory", "nosferatu_prime", "the_hunter_van_helsing"],
    "setting": "The shadow kingdoms of the vampire nobility",
    "timeframe": "The Long Night"
  },

  "chapters": [
    "chapter_vampire_01",
    "chapter_vampire_02",
    "chapter_vampire_03",
    "chapter_vampire_04",
    "chapter_vampire_05",
    "chapter_vampire_06"
  ],

  "introCinematic": "cinematic_vampire_intro",
  "outroCinematic": "cinematic_vampire_finale",

  "unlockRequirements": {
    "prerequisiteCampaigns": ["campaign_undead"],
    "isUnlockedByDefault": false
  },

  "rewards": {
    "experienceTotal": 5500,
    "unlockedHeroes": ["hero_blood_lord", "hero_nightstalker"],
    "achievements": ["achievement_vampire_campaign_complete"]
  },

  "ui": {
    "themeColor": "#8B0000",
    "thumbnailImage": "campaigns/vampire/thumbnail.png",
    "bannerImage": "campaigns/vampire/banner.png"
  },

  "audio": {
    "menuMusic": "music/vampire/theme_gothic.ogg",
    "mainTheme": "music/vampire/requiem_blood.ogg"
  },

  "metadata": {
    "estimatedPlaytime": 12,
    "tags": ["dark", "political", "horror"]
  }
}
